{
  "register_id": "EBA_CREDIT_INSTITUTIONS_REGISTER",
  "contract_version": "1.0.0",
  "g0_freeze": "G0.1",
  "authority": "European Banking Authority (EBA)",
  "register_name": "EBA Register of Credit Institutions",
  "official_url": "https://webgate.ec.europa.eu/eba-cir/",
  "legal_basis": "Directiva 2013/36/UE (CRD IV), articulo 10: lista de instituciones con LEI y permiso de captacion de depositos (H3: verificar campos publicados)",
  "entity_classes_covered": ["CREDIT_INSTITUTION"],
  "excluded_entity_classes": ["PAYMENT_INSTITUTION", "E_MONEY_INSTITUTION", "INVESTMENT_FIRM_ESI", "FINANCIAL_ADVISER_EAF", "FUND_MANAGER_SGIIC", "CASP", "PSP_AGENT"],
  "activities_covered": ["DEPOSIT_TAKING", "LENDING"],
  "jurisdictions": ["EEA"],
  "territorial_regimes": ["DOMESTIC", "BRANCH"],
  "update_cadence": "UNKNOWN (H3)",
  "max_positive_staleness_days": 90,
  "max_negative_staleness_days": 60,
  "supports_source_as_of": null,
  "negative_evidence_capability": "EXPLICIT_NEGATIVE_ONLY",
  "identity_fields": ["legal_name", "LEI", "HOME_STATE_ID"],
  "raw_format": "HTML + (H3: verificar descarga masiva)",
  "supports_bulk_snapshot": null,
  "coverage_rules": [
    {
      "rule_id": "eba-cir-in-eea",
      "scope": "IN",
      "entity_class": "CREDIT_INSTITUTION",
      "activities": null,
      "jurisdictions": null,
      "territorial_bases": ["DOMESTIC", "BRANCH"],
      "valid_from": null,
      "valid_to": null,
      "note": "Entidades de credito del EEE"
    },
    {
      "rule_id": "eba-cir-out-non-credit",
      "scope": "OUT",
      "entity_class": "PAYMENT_INSTITUTION",
      "activities": null,
      "jurisdictions": null,
      "territorial_bases": null,
      "valid_from": null,
      "valid_to": null,
      "note": "El CIR no lista PI/EMI ni demas clases; extension a las clases excluidas del contrato"
    }
  ],
  "notes": [
    "Lag demostrable respecto de registros nacionales: una revocacion en BdE puede convivir con estado activo en CIR (fixture S10). Politica C2: conflicto => INDETERMINATE.",
    "H3: verificar campos reales publicados (LEI, permiso de deposito), cadencia y descarga masiva."
  ],
  "verification": {
    "legal_basis": {"status": "PENDING", "source_url": null, "note": "H3: verificar articulo 10 CRD IV y contenido exacto del listado"},
    "official_url": {"status": "PENDING", "source_url": null, "note": "Verificar URL actual del registro"},
    "update_cadence": {"status": "PENDING", "source_url": null, "note": "H3"},
    "supports_bulk_snapshot": {"status": "PENDING", "source_url": null, "note": "H3/C3"},
    "max_positive_staleness_days": {"status": "PROPOSED", "source_url": null, "note": "Politica propia"},
    "max_negative_staleness_days": {"status": "PROPOSED", "source_url": null, "note": "Politica propia"},
    "negative_evidence_capability": {"status": "PROPOSED", "source_url": null, "note": "Conservador: completitud no verificada"}
  }
}
