{
  "register_id": "BDE_REGISTRO_ENTIDADES",
  "contract_version": "1.0.0",
  "g0_freeze": "G0.1",
  "authority": "Banco de Espana",
  "register_name": "Registro de entidades del Banco de Espana",
  "official_url": "https://www.bde.es/wbe/es/punto-informacion/contenidos/registros/registros-entidades/",
  "legal_basis": "Ley 10/2014, de 26 de junio, de disciplina e intervencion de las entidades de credito (articulos del registro por verificar H7); Ley 16/2009 para servicios de pago; RD 84/2015",
  "entity_classes_covered": ["CREDIT_INSTITUTION", "PAYMENT_INSTITUTION", "E_MONEY_INSTITUTION", "PSP_AGENT"],
  "excluded_entity_classes": ["INVESTMENT_FIRM_ESI", "FINANCIAL_ADVISER_EAF", "FUND_MANAGER_SGIIC", "CASP"],
  "activities_covered": ["DEPOSIT_TAKING", "LENDING", "PAYMENT_SERVICES", "E_MONEY_ISSUANCE"],
  "jurisdictions": ["ES"],
  "territorial_regimes": ["DOMESTIC", "BRANCH"],
  "update_cadence": "UNKNOWN (H8: verificar si la interfaz expone fecha de actualizacion)",
  "max_positive_staleness_days": 90,
  "max_negative_staleness_days": 45,
  "supports_source_as_of": null,
  "negative_evidence_capability": "EXPLICIT_NEGATIVE_ONLY",
  "identity_fields": ["legal_name", "NIF", "BDE_REGISTRY_ID", "LEI"],
  "raw_format": "Datos publicados por BdE (paginas de registro) + listas CSV de determinadas clasificaciones financieras; H8: verificar si el volcado existente es completo y apto para negativos",
  "supports_bulk_snapshot": null,
  "coverage_rules": [
    {
      "rule_id": "bde-in-domestic",
      "scope": "IN",
      "entity_class": null,
      "activities": null,
      "jurisdictions": ["ES"],
      "territorial_bases": ["DOMESTIC"],
      "valid_from": null,
      "valid_to": null,
      "note": "Entidades inscritas con domicilio/autorizacion nacional"
    },
    {
      "rule_id": "bde-in-branch",
      "scope": "IN",
      "entity_class": null,
      "activities": null,
      "jurisdictions": ["ES"],
      "territorial_bases": ["BRANCH"],
      "valid_from": null,
      "valid_to": null,
      "note": "Sucursales en Espana de entidades extranjeras de clases cubiertas (H6: verificar enumeracion)"
    },
    {
      "rule_id": "bde-out-fps-inbound",
      "scope": "OUT",
      "entity_class": null,
      "activities": null,
      "jurisdictions": null,
      "territorial_bases": ["FREEDOM_TO_PROVIDE_SERVICES"],
      "valid_from": null,
      "valid_to": null,
      "note": "W3/H6: no se asume que el registro BdE enumere prestacion inbound por FPS; bloquea negativos y positivos desde BdE para ese regimen"
    }
  ],
  "notes": [
    "Capacidad negativa: los estados de la fuente (baja, revocacion) son evidencia negativa explicita SOLO si H5 confirma la semantica del estado (H5: 'cancelada' puede no extinguir derechos residuales en liquidacion).",
    "Las filas de agentes (PSP_AGENT) no son entitlement independiente: exigen principal_entity_id (W1).",
    "No se asume enumeracion completa: RATIONALE: no complete, authoritative enumeration suitable for negative inference has yet been verified (C3). La fuente publica datos identificativos, historico/variaciones y listas CSV para determinadas clasificaciones; su idoneidad para negativos la decide H8, no una etiqueta 'solo-consulta'."
  ],
  "verification": {
    "authority": {"status": "VERIFIED", "source_url": "https://www.bde.es/wbe/es/punto-informacion/contenidos/registros/registros-entidades/", "note": "BdE publica los Registros de entidades en esta pagina oficial"},
    "entity_classes_covered": {"status": "PENDING", "source_url": null, "note": "H6/H8: verificar listado exacto de secciones del registro"},
    "update_cadence": {"status": "PENDING", "source_url": null, "note": "H8"},
    "supports_source_as_of": {"status": "PENDING", "source_url": null, "note": "H8: verificar si los datos publicados declaran fecha de actualizacion"},
    "supports_bulk_snapshot": {"status": "PENDING", "source_url": null, "note": "H8: verificar si existe volcado COMPLETO y apto para negativos; no se asume que la consulta interactiva sea la unica via"},
    "max_positive_staleness_days": {"status": "PROPOSED", "source_url": null, "note": "Politica propia conservadora, no hecho de la fuente"},
    "max_negative_staleness_days": {"status": "PROPOSED", "source_url": null, "note": "Politica propia: negativos caducan antes que positivos"},
    "negative_evidence_capability": {"status": "PROPOSED", "source_url": null, "note": "EXPLICIT_NEGATIVE_ONLY: no se ha verificado una enumeracion completa y apta para negativos (H8); promocionable a COMPLETE_ENUMERATION sin cambiar el modelo"},
    "legal_basis": {"status": "PENDING", "source_url": null, "note": "H7: verificar articulos exactos de Ley 10/2014 y Ley 16/2009"}
  }
}
