{"activities_covered":["CRYPTO_ASSET_SERVICES","CRYPTO_CUSTODY_ADMINISTRATION","CRYPTO_TRADING_PLATFORM","CRYPTO_EXCHANGE_FUNDS","CRYPTO_EXCHANGE_CRYPTO","CRYPTO_ORDER_EXECUTION","CRYPTO_PLACING","CRYPTO_ORDER_RECEPTION_TRANSMISSION","CRYPTO_ADVICE","CRYPTO_PORTFOLIO_MANAGEMENT","CRYPTO_TRANSFER"],"authority":"Finanstilsynet (Norwegian Financial Supervisory Authority)","contract_version":"1.0.0","coverage_rules":[{"activities":null,"entity_class":null,"jurisdictions":null,"note":"Evidencia corroborante del mecanismo home MiCA: el campo remarks de la ficha puede citar expresamente la via (p.ej. MiCA Article 60(3)). Nunca decide territorialidad.","rule_id":"finanstilsynet-in-home-mechanism","scope":"IN","territorial_bases":null,"valid_from":null,"valid_to":null}],"entity_classes_covered":["CASP","INVESTMENT_FIRM_ESI","CREDIT_INSTITUTION"],"excluded_entity_classes":[],"g0_freeze":"G1-D-F01","identity_fields":["legal_name","finanstilsynet_id","lei"],"jurisdictions":["EEA"],"legal_basis":"Reglamento (UE) 2023/1114 (MiCA) art. 59(1)/60: el registro Finanstilsynet lista licencias y remarks del NCA home (entidades extranjeras con actividad en Noruega)","max_negative_staleness_days":15,"max_positive_staleness_days":30,"negative_evidence_capability":"NO_NEGATIVE_INFERENCE","notes":["G1-D-F01: corroboracion NCA del mecanismo home; IG Europe remarks=\"authorised to provide crypto asset services pursuant to MiCA Article 60(3)\"."],"official_url":"https://www.finanstilsynet.no/en/finanstilsynets-registry/","raw_format":"HTML ficha por entidad (React VregDetails con licences/remarks embebidos)","register_id":"FINANSTILSYNET_REGISTRY","register_name":"Finanstilsynets registry (registro oficial de entidades supervisadas)","supports_bulk_snapshot":null,"supports_source_as_of":false,"territorial_regimes":["DOMESTIC","BRANCH","FREEDOM_TO_PROVIDE_SERVICES","OTHER"],"update_cadence":"UNKNOWN","verification":{"authority":{"note":"pagina oficial de la NCA home, snapshot congelado en manifest-g1-d2","source_url":"https://www.finanstilsynet.no/en/finanstilsynets-registry/","status":"VERIFIED"},"legal_basis":{"note":"MiCA art. 59(1) verificado contra eurlex-mica-2023-1114-es.html congelado: 59(1)(a)=art.63 autorizacion; 59(1)(b)=entidad financiera art.60","source_url":"https://eur-lex.europa.eu/eli/reg/2023/1114/oj","status":"VERIFIED"},"max_negative_staleness_days":{"note":"Politica propia","source_url":null,"status":"PROPOSED"},"max_positive_staleness_days":{"note":"Politica propia","source_url":null,"status":"PROPOSED"},"negative_evidence_capability":{"note":"Conservador: sin completitud verificada no hay inferencia negativa","source_url":null,"status":"PROPOSED"},"supports_source_as_of":{"note":"pagina viva sin fecha de datos publicada: source_as_of UNAVAILABLE, freshness por retrieved_at","source_url":"https://www.finanstilsynet.no/en/finanstilsynets-registry/","status":"VERIFIED"}}}
