{"activities_covered":["CRYPTO_ASSET_SERVICES","CRYPTO_CUSTODY_ADMINISTRATION","CRYPTO_TRADING_PLATFORM","CRYPTO_EXCHANGE_FUNDS","CRYPTO_EXCHANGE_CRYPTO","CRYPTO_ORDER_EXECUTION","CRYPTO_PLACING","CRYPTO_ORDER_RECEPTION_TRANSMISSION","CRYPTO_ADVICE","CRYPTO_PORTFOLIO_MANAGEMENT","CRYPTO_TRANSFER"],"authority":"Bundesanstalt fuer Finanzdienstleistungsaufsicht (BaFin)","contract_version":"1.0.0","coverage_rules":[{"activities":null,"entity_class":null,"jurisdictions":null,"note":"Evidencia del mecanismo home MiCA: la cita del permiso cripto distingue Art. 59 Abs. 1a (autorizacion art.63) de Art. 59 Abs. 1b (entidad financiera art.60, notificacion). Nunca decide territorialidad — compone con el registro territorial (CNMV).","rule_id":"bafin-udb-in-home-mechanism","scope":"IN","territorial_bases":null,"valid_from":null,"valid_to":null}],"entity_classes_covered":["CASP","INVESTMENT_FIRM_ESI","CREDIT_INSTITUTION"],"excluded_entity_classes":[],"g0_freeze":"G1-D-F01","identity_fields":["legal_name","bafin_id","bak_nr"],"jurisdictions":["EEA"],"legal_basis":"Reglamento (UE) 2023/1114 (MiCA) art. 59(1): la Unternehmensdatenbank cita por permiso la base legal — Art. 59 Abs. 1a i.V.m. Art. 3 Abs. 1 Nr. 16 = CASP art.63; Art. 59 Abs. 1b = entidad financiera autorizada via art.60","max_negative_staleness_days":15,"max_positive_staleness_days":30,"negative_evidence_capability":"NO_NEGATIVE_INFERENCE","notes":["G1-D-F01: fuente primaria del mecanismo home para CASPs con home NCA BaFin; el campo ESMA ac_authorisationNotificationDate no distingue las vias y nunca decide el mecanismo.","Controles de discriminacion verificados en la misma base: Boerse Stuttgart Digital Custody (CASP puro) cita Art. 59 Abs. 1a; Zodia/tradias (entidades financieras) citan Art. 59 Abs. 1b."],"official_url":"https://portal.mvp.bafin.de/database/InstInfo/","raw_format":"HTML ficha por instituto (Erlaubnisse/Zulassung/Taetigkeiten con cita legal por permiso)","register_id":"BAFIN_UNTERNEHMENSDATENBANK","register_name":"BaFin Unternehmensdatenbank (base oficial de empresas supervisadas)","supports_bulk_snapshot":null,"supports_source_as_of":false,"territorial_regimes":["DOMESTIC","BRANCH","FREEDOM_TO_PROVIDE_SERVICES","OTHER"],"update_cadence":"UNKNOWN","verification":{"authority":{"note":"pagina oficial de la NCA home, snapshot congelado en manifest-g1-d2","source_url":"https://portal.mvp.bafin.de/database/InstInfo/","status":"VERIFIED"},"legal_basis":{"note":"MiCA art. 59(1) verificado contra eurlex-mica-2023-1114-es.html congelado: 59(1)(a)=art.63 autorizacion; 59(1)(b)=entidad financiera art.60","source_url":"https://eur-lex.europa.eu/eli/reg/2023/1114/oj","status":"VERIFIED"},"max_negative_staleness_days":{"note":"Politica propia","source_url":null,"status":"PROPOSED"},"max_positive_staleness_days":{"note":"Politica propia","source_url":null,"status":"PROPOSED"},"negative_evidence_capability":{"note":"Conservador: sin completitud verificada no hay inferencia negativa","source_url":null,"status":"PROPOSED"},"supports_source_as_of":{"note":"pagina viva sin fecha de datos publicada: source_as_of UNAVAILABLE, freshness por retrieved_at","source_url":"https://portal.mvp.bafin.de/database/InstInfo/","status":"VERIFIED"}}}
