{"activities_covered":["CRYPTO_ASSET_SERVICES"],"authority":"CNMV","contract_version":"1.1.0","coverage_rules":[{"activities":null,"entity_class":"CASP","jurisdictions":["ES"],"note":"CASP con actividad en Espana incluidos regimenes transitorios; etiquetas de regimen por verificar contra H1","rule_id":"cnmv-mica-in-domestic","scope":"IN","territorial_bases":["DOMESTIC"],"valid_from":null,"valid_to":null},{"activities":null,"entity_class":"CASP","jurisdictions":["ES"],"note":"G1-D: categorias territoriales observadas — PSC EN REGIMEN DE LP (-> FREEDOM_TO_PROVIDE_SERVICES) y PSC ... A TRAVES DE SUCURSAL (-> BRANCH); services_from es la fecha territorial juridica. LIMITED PSC EN REGIMEN DE LP: epigrafe sin filas ni fuente primaria -> abstencion siempre (H12-E)","rule_id":"cnmv-mica-in-territorial","scope":"IN","territorial_bases":["BRANCH","FREEDOM_TO_PROVIDE_SERVICES"],"valid_from":null,"valid_to":null}],"entity_classes_covered":["CASP"],"excluded_entity_classes":[],"g0_freeze":"G0.1","identity_fields":["legal_name"],"jurisdictions":["ES"],"legal_basis":"Reglamento (UE) 2023/1114 (MiCA): arts. 60/63 (mecanismo, verificado G1-C) y arts. 59(7)/65 (activacion territorial, verificado G1-D); categoria + services_from del listado son el trigger territorial ES","max_negative_staleness_days":15,"max_positive_staleness_days":30,"negative_evidence_capability":"NO_NEGATIVE_INFERENCE","notes":["H2: el listado NO proporciona NIF, LEI ni numero estable de registro (premisa del enunciado por verificar). La identidad debe resolverse via ESMA_MICA_REGISTER o autoridad home-state (G0.2, adopcion W6).","NO_NEGATIVE_INFERENCE: la ausencia en este listado no permite conclusion negativa alguna (lag respecto de ESMA, completitud sin verificar, y entidades financieras bajo notificacion art. 63 pueden no figurar).","C4: desde 2026-07-01 los regimenes transitorios estan cerrados (H1: verificar fecha); las aserciones heredadas vencen por effective_to.","G1-D: la categoria CNMV ancla el mecanismo (60/63) Y la ruta territorial; la fecha juridica territorial es services_from, nunca la fecha ESMA de autorizacion home."],"official_url":"https://www.cnmv.es/portal/consultas/criptoactivos.aspx?lang=es","raw_format":"HTML (H2: verificar si existe NIF/LEI/numero estable oculto o en detalle de registro)","register_id":"CNMV_MICA_CASP_LIST","register_name":"Listado CNMV de prestadores de servicios sobre criptoactivos (MiCA)","supports_bulk_snapshot":null,"supports_source_as_of":null,"territorial_regimes":["DOMESTIC","BRANCH","FREEDOM_TO_PROVIDE_SERVICES"],"update_cadence":"UNKNOWN (H8)","verification":{"identity_fields":{"note":"G1-C: confirmado — el listado no expone NIF/LEI; identidad por adopcion via ESMA (W6)","source_url":"https://www.cnmv.es/portal/consultas/criptoactivos.aspx?lang=es","status":"VERIFIED"},"legal_basis":{"note":"G1-C: art. 60/63; G1-D: art. 59(7)/65 contra texto MiCA congelado (eurlex-mica-2023-1114-es.html)","source_url":"https://eur-lex.europa.eu/eli/reg/2023/1114/oj","status":"VERIFIED"},"max_negative_staleness_days":{"note":"Politica propia","source_url":null,"status":"PROPOSED"},"max_positive_staleness_days":{"note":"Politica propia: listado de movimiento rapido","source_url":null,"status":"PROPOSED"},"negative_evidence_capability":{"note":"Conservador: sin completitud verificada no hay inferencia negativa","source_url":null,"status":"PROPOSED"},"official_url":{"note":"Verificar URL exacta del listado","source_url":null,"status":"PENDING"}}}
