{
  "register_id": "HOME_STATE_AUTHORITY_TEMPLATE",
  "contract_version": "1.0.0",
  "g0_freeze": "G0.1",
  "authority": "TEMPLATE: autoridad del Estado miembro de origen (instanciar por NCA)",
  "register_name": "Registro nacional de origen de la entidad pasaportada",
  "official_url": "https://www.lb.lt/en (ejemplo: Lietuvos Bankas; H6: verificar URL del registro concreto)",
  "legal_basis": "Derecho nacional del Estado miembro de origen + Directiva aplicable (PSD2/CRD/MiFID II/MiCA) para el pasaporte",
  "entity_classes_covered": ["CREDIT_INSTITUTION", "PAYMENT_INSTITUTION", "E_MONEY_INSTITUTION", "INVESTMENT_FIRM_ESI", "CASP"],
  "excluded_entity_classes": [],
  "activities_covered": ["DEPOSIT_TAKING", "LENDING", "PAYMENT_SERVICES", "E_MONEY_ISSUANCE", "INVESTMENT_SERVICES", "CRYPTO_ASSET_SERVICES"],
  "jurisdictions": ["EEA"],
  "territorial_regimes": ["DOMESTIC"],
  "update_cadence": "UNKNOWN (por NCA)",
  "max_positive_staleness_days": 90,
  "max_negative_staleness_days": 45,
  "supports_source_as_of": null,
  "negative_evidence_capability": "EXPLICIT_NEGATIVE_ONLY",
  "identity_fields": ["legal_name", "LEI", "HOME_STATE_ID"],
  "raw_format": "POR INSTANCIA: HTML/API/descarga; documentar por NCA en G0.5",
  "supports_bulk_snapshot": null,
  "coverage_rules": [
    {
      "rule_id": "home-in-domestic",
      "scope": "IN",
      "entity_class": null,
      "activities": null,
      "jurisdictions": null,
      "territorial_bases": ["DOMESTIC"],
      "valid_from": null,
      "valid_to": null,
      "note": "El registro de origen es competente para el estado de autorizacion en el Estado de origen; para ES solo aporta el hecho del pasaporte, no el derecho español vigente"
    }
  ],
  "notes": [
    "Instanciar UN contrato por autoridad home-state usada en el corpus (G0.5).",
    "Para entidades inbound, la fuente decisiva del regimen territorial en ES sigue siendo el marco ES + registro EU pertinente (EBA/ESMA); el registro home confirma la autorizacion de origen y sus limites.",
    "Si la autoridad home no publica source_as_of, freshness_at cae a retrieved_at con reliability UNAVAILABLE."
  ],
  "verification": {
    "official_url": {"status": "PENDING", "source_url": null, "note": "H6: por instancia, verificar URL y formato"},
    "entity_classes_covered": {"status": "PENDING", "source_url": null, "note": "Por instancia"},
    "max_positive_staleness_days": {"status": "PROPOSED", "source_url": null, "note": "Politica propia por instancia"},
    "max_negative_staleness_days": {"status": "PROPOSED", "source_url": null, "note": "Politica propia por instancia"}
  }
}
